{
  "$schema": "https://json-schema.org/draft/2020-12/schema",
  "$id": "https://wasmagent.dev/schemas/package/v0.1.schema.json",
  "title": "Package",
  "description": "Descriptor for a published WasmAgent protocol package release — the machine-readable manifest of which canonical schemas a given version of @wasmagent/protocol (npm) / wasmagent-protocol (PyPI) bundles, where it is published, and the canonical host its schemas resolve under. Lets consumers pin and verify a release against the registry without depending on prose.",
  "type": "object",
  "required": [
    "name",
    "version",
    "canonical_host",
    "schemas"
  ],
  "additionalProperties": false,
  "properties": {
    "name": {
      "type": "string",
      "description": "Published package name, e.g. @wasmagent/protocol (npm) or wasmagent-protocol (PyPI)"
    },
    "version": {
      "type": "string",
      "description": "Semver release version of the package, e.g. 0.1.7"
    },
    "canonical_host": {
      "type": "string",
      "format": "uri",
      "description": "Canonical host prefix every bundled schema $id resolves under, e.g. https://wasmagent.dev/schemas/"
    },
    "registries": {
      "type": "array",
      "description": "Distribution registries the package is published to",
      "items": {
        "type": "object",
        "required": [
          "name",
          "url"
        ],
        "additionalProperties": false,
        "properties": {
          "name": {
            "type": "string",
            "description": "Registry identifier, e.g. npm or pypi"
          },
          "url": {
            "type": "string",
            "format": "uri",
            "description": "Canonical registry URL for this package release"
          }
        }
      }
    },
    "schemas": {
      "type": "array",
      "description": "Canonical schemas bundled in this package release",
      "items": {
        "type": "object",
        "required": [
          "id",
          "canonical_id",
          "version"
        ],
        "additionalProperties": false,
        "properties": {
          "id": {
            "type": "string",
            "description": "Registry id of the bundled schema, e.g. aep-record"
          },
          "canonical_id": {
            "type": "string",
            "format": "uri",
            "description": "Canonical $id the schema declares, e.g. https://wasmagent.dev/schemas/aep/aep-record.schema.json"
          },
          "version": {
            "type": "string",
            "description": "Schema-version tag bundled in this release, e.g. aep/v0.3"
          },
          "stability": {
            "type": "string",
            "enum": [
              "stable",
              "evolving",
              "unstable"
            ],
            "description": "Contract stability of the bundled schema"
          }
        }
      }
    },
    "published_at": {
      "type": "string",
      "pattern": "^\\d{4}-\\d{2}-\\d{2}T\\d{2}:\\d{2}:\\d{2}(\\.\\d+)?(Z|[+-]\\d{2}:\\d{2})$",
      "description": "Publication timestamp in ISO 8601 format"
    },
    "license": {
      "type": "string",
      "description": "SPDX license identifier, e.g. Apache-2.0"
    }
  }
}
